additional_comments_or_suggestions_about_Application_and_Registration_Process.csv,additional_comments_or_suggestions_about_the_Curriculum.csv,additional_comments_or_suggestions_about_Networking.csv,additional_comments_or_suggestions_about_the_Bonus_Lectures.csv,additional_comments_or_suggestions_about_the_Operational_and_Technical_Aspects.csv,additional_comments_or_suggestions_about_the_Practice_Weeks.csv,additional_comments_or_suggestions_about_the_Schedule_and_Attandance.csv,additional_comments_or_suggestions.csv,should_exams_be_part_of_the_curriculum.csv,screening_criteria.csv,decision_to_sign.csv,members_content.csv,what-kind-of-interactivity.csv,suggested-price.csv,what-to-add-for-curriculum.csv
,"Professors could do more interactions during lessons. Try to solve some situations during live class. Find answers with students, discuss more.",,,,,5,"Instead of covering the topic with monologue, professors should try to find how to interact more with students. In my opinion, some of the lectures were really boring. The others, was much better because of the professors character. That makes big difference. Some of the topic can be more interactive, maybe you should try to find/create the other apps, where students can solve some tasks, create and work out different situations related to topic. Based on the answers lessons can run. While discussing mistake and different point of views. That way can bring more attention from students and the most important, learning process can double up.",Yes,Recommendation Letter,"Social Media Post(s), Former Alumni(s)","Q&A, Topic based","Direct questions to the students, Instant questions allowed, Questions in the end or seperate session",Price is okay,"Sport Management, Sports Psychology"
"it could be more transparent, clearer and more strict ","Generally I would say same things like in previous part. More demanding, more interactive, more serious for the students","I was little bit disappointed about no difference aproach to the generations students and only congress visitors. I literally felt like it means nothing there to studying in the program for months in comparison to whoever who just pay and come for the congress.  No blame or regrets, but honestly it felt little bit dehonestating for the students. 

And of course, I missed more interactivity between lectors and attendees, absence of moderating of discussions and it all due to not using available tools and technologies.","Love the idea of it, but missing more structured approach, now is like more ad hoc and shock dropping to me and it’s not fit much to me because of daily business. When I will be 15 years younger students, I wouldn’t mind, but life of 36 years old working man needs longer period schedules",it would be really long list,it would be many ,1,"thank you for what you doing, I am unbelievably happy to had an opportunity to spend time with you all and for what you just have provided for me. It was one of the best experiences of my life, because for some few months I felt fulfilled with energizing happiness. Tbh, especially in mirror of what I was coming through last year in my life, this program, the feeling of being part of  EHCB was very often the only one thing which fueled me on and made me smile a little. I am not kidding right now and I don’t want be too sentimental, but seriously, EHCB was like a family for me in last months and I am really thankful to you. Please be sure, that when congress ends, I felt nothing but sadness because I realized, it’s just over. So please, keep doing what you do, keep growing as a organisation (I see unbelieve potential of product what you have) and keep giving us the opportunities to feel like a just felt last few months. In these days, whole sociaty need it. Hope there will be some opportunities to stay in touch with EHCB, because it’s awesome. ",Yes,"Resume, Recommendation Letter, Minimum # of years of experience, Coaching Licence Level, personal interview, identification of personal motivation, values and maybe some kind of entrance exam ","Former Alumni(s), lifetime situation finally allowed it","Q&A, Topic based, always combination ","Direct questions to the students, Instant questions allowed, again tricky question, it depends on many factors - I was studying at the university to get my diploma which get me some kind of privilege - so it was serious and student have to obey profs rules and do something and from that perspective it should be more demanding for students. But in the other hand, if the perspective of this program is more like more voluntary knowledge sharing platform, my answer would be different here. ","Tricky question because the real value of the price it’s always individual because it’s always set by customers expectations which are based on their personal experiences, motivations and financial situation   So from my perspective I would diplomatically say that the price for another generations without any significant changes in the program should remain the same.","Sports Psychology, Sport management would be great, but when Sports MBA program by the Euroleague Basketball institute does exist, I don’t think addition of this could be right fitting step."
Onboarding pack would save you questions. Also it should contain exactly what is covered and other info,Finance/data analytics,Specific networking event with a drink and the coaches/students there,"Great topics, great guests. Short notice makes it difficult to follow but I appreciate this is down to the guests",Whatsapp doesnt work great due to the volume of messages and people spamming. Not easy for the organisers either. Sometimes people dont check phones and might miss important messages. A platform would be great but it comes at a cost.,It was a strange week for the team so didn’t make the most of it. Also took a whole week off work but we only really needed two days,4,"Exit opportunities clarified, sufficient notice for lectures, more group tasks",Yes,"Resume, Minimum # of years of experience",Congress from previous generations,"Q&A, Topic based","More like a video cast, one way communication to watch it later", Same if possible,"Sport Management, Sports Psychology, Would be interesting to understand the financial aspects. Also, a lecture on advanced basketball data would be great"
,,,,,I didn’t participate,5,"In general, I think this is great program! I received much more than I expected! 
For me it is just a pity that I missed my practice weak as I can’t go for that long away during the season. 
The Congress was absolutely amazing! Program at the Congress was on the highest level and Glyfada was fantastic! ",Yes,"Resume, Minimum # of years of experience","Social Media Post(s), Congress from previous generations",Q&A,"More like a video cast, one way communication to watch it later",Really don’t know,Sport Management
,,"It was a feeling that a few of the Students had ""a better treatment"" than others.

It could have been organized a social event for the 4th generation.",,"A lot of spamming in WhatsApp chat which doesn't help to find anything you need.
Using WhatsApp is dangerous if someone's change mobile device. It's easy to lose the whole chat and additionally you are not able to see what was writtern before you ender the chat.

As mentioned before:
Teams should have been the second source of checking for the Tests' deadlines, since we had a link of Exam Topics-Dates. I have missed one test unfortunately. The one I asked you the questions which were included.

Regarding lectures, it should be allowed to be downloaded for personal use.","As per my email sent on May.

Training Weeks
One of the most important periods, the Program offers in my opinion and thank you for this opportunity.
- Each Team/Coach has different approach to this, which somehow doesn't make it fair to everyone. For example Weeks in Real, Partizan, Monaco and Red Star, as far as I know, were by far the best.
I suggest you set a minimum of specific things that a Team/Coach can offer to the students that participate. For example:
At least one Scouting/VIdeo Session.
Time spent with Players and Coaching Staff.
At least one member of the Coaching Staff or a member of EHCB who would be in charge to explain what is happening during the practices.
Meetings and spend time with other departments of groups of people that a Head Coach is cooperating with like physios, doctors, management team.
Tour in the locker rooms and the facilities.
During the games seats near the bench in order for the students to have a better picture of ingame coaching.
My experience with Olympiacos, as we had already informed you back then, was not what we were expecting.
We were standing behind the baseline just watching the sessions, no one from the EHCB or the coaching staff was there to explain anything to us, except the last day at the end of the practice.
We did not have any video sessions or meetings with players.

I would suggest agreeing with each Coach and each team about the period of the weeks that they will be more beneficial. For example, there are Coaches, like Coach Bartzokas, that maybe they would prefer to have the students during the preseason. It is something that Coach Bartzokas also suggested.

The most unpleasant was when one day when everyone had left the stadium, one of the students (who probably privately asked coach Triantafyllos), had a private Scouting/Video session for about 40-45 minutes, with scouting reports provided etc.
He did share everything with us, and I thank him, but it is totally different than having a session with a member of the coaching staff.
Obviously, it was a genuine mistake and not something intentionally.",3,"There were not equal oportunities for all the Students to meet and discuss with the members of EHCB. It is part of the life, that if you know someone, you have better approach.
Unfortunately, I do not have any suggestions on how to imporve this.",Yes,"Resume, Minimum # of years of experience, Coaching Licence Level, I suggest a Test (like the one we have during the season), before the start of the Programm each season, would be more fair than a video creation.","Website, Phone Call Interview","Q&A, Topic based","Instant questions allowed, Questions in the end or seperate session","Evaluation of Coaches background. Some of us have already studied at a similar University and it would be more fair to have a discount, since we have already studied the University lectures part.","Sport Management, Sports Psychology"
,,I think Congress was really great,,,Maybe Is some of student has no chance to attend practice week during the season it’s could be as option to implement also practice week with some national team during the summer. Let’s say in my case I would join some national team in the summer to watch and learn.,5,I really like my experience studying in EHCB. I had a lot of chances to learn and also to build networking . Thanks a lot,Yes,Minimum # of years of experience,Former Alumni(s),Topic based,Questions in the end or seperate session,Same price ,Sports Psychology
,,,,,,5,It was a nice experience I would recommend to everyone ,Yes,Resume,Social Media Post(s),Q&A,Instant questions allowed,1500,Sports Psychology
,,,,,,5,It was worth it ,Yes,"Resume, Coaching Licence Level","Website, Social Media Post(s)",Topic based,Instant questions allowed,1000,Sports Psychology
,,,,,,5,It’s a good experience ,Yes,"Resume, Coaching Licence Level",Social Media Post(s),Q&A,"Direct questions to the students, More like a video cast, one way communication to watch it later",2500,Sport Management
Talking with coaches' clubs managers,,,,,,3,Create more zoom calls to discuss about basketball just between alumni ,Yes,Resume,"Social Media Post(s), Video Content from previous generations",Topic based,Instant questions allowed,1600,Sport Management
,,I was unable to attend the congress this year due to national team commitments. ,,,I was unable to attend a practice week due to the scheduling of my academy. ,5,"The EHCB Coaches Academy's 4th Generation program has been an exceptional experience. The updated curriculum provided a comprehensive and immersive learning journey. Despite not being able to attend the congress this year as I did last year, I heard a lot of positive feedback from the coaches and gained valuable insights from their presentations.

The new modules, such as EuroLeague Assistant Coaches Scouting and Strength & Conditioning Coaches Lectures, have significantly expanded our knowledge base, offering cutting-edge insights. The program's structure, with a mix of online lectures and in-person sessions, allowed us to balance our daily work while advancing our coaching skills.

The academic partnership with the University of Belgrade and the involvement of EHCB members have elevated the quality of education, making it one of the premier coaching programs globally. The EHCB Coaches Congress, as reported by my peers, featured engaging panel discussions, masterclasses, and invaluable networking opportunities.

I highly recommend the EHCB Coaches Academy to anyone serious about advancing their coaching career. The knowledge, experience, and connections gained through this program are truly transformative, positioning it at the forefront of basketball coaching education.",Yes,"Resume, Recommendation Letter, Minimum # of years of experience, Coaching Licence Level","Video Content from previous generations, Congress from previous generations","Q&A, Topic based","Questions in the end or seperate session, More like a video cast, one way communication to watch it later",2000,"Sport Management, Sports Psychology"
,If the goal of EHCB is to have a big number of student is almost impossible to do open lecture with Q/A cause not everyone can ask questions. So general lecture to explain and discuss the topic and questions send via email would be more efficent,,,Reminder should be send to people instead of unpolite answer ,Practice week was amazing thanks to real Madrid staff but we couldn't get clarity in terms of time before starting,2,"EHCB is a great organisation and academy is great. You need to decide which road take in order to provide a better experience. Keep it for everyone (as I prefer) or just for professional.
That will change all of the organisation and of course the price",No,None,"Website, Video Content from previous generations, Congress from previous generations",Topic based,"More like a video cast, one way communication to watch it later",2000 euros,Sports Psychology
"Website form needs some updates. As I remember it was not the most user friendly form. 

Also maybe another small research could be done for selection criterias/procedure and implemented with help of some HR experts or industrial psychologists (if possible from the alumnis) to convert this process almost like a ""hiring"" process with different mechanism. First deciding the ""profiles"" / ""roles"" needed and then selecting from the candidates. Goal would be keeping quality high but at the same time keeping the variety. Because I really liked  seeing very young coaches, very experienced coaches, coaches from countless different countries, cultures etc. Academy should be always open to everyone who really wants and who would give its due, who would give the value it deserves. ","Maybe something like a ""graduation project"" could be added to the curriculum. Probably not possible to do it per individuals but for the first year, as a trial, pre-defined projects are offered to everyone then everyone selects one  from the topics (S&C, Psychology, Technology, Anatomy, Scouting...). Some of them could be even related to the Academy itself. Helping the staff from technical perspective or operational perspective might be a good experience for the students as well (IT work group, Practice Weeks work group, Congress Work group etc.). Or the students come up with ideas/proposals. This would create a real self sufficient community, more hands on experiences, more interactions, more impact to everyone and in my opinion would be more chance to teach everyone from the youngest coach to the most experienced national team level coaches. It would create more internship or even finding a job kind of chances in natural and mutual way. 

Content/topic wise I liked the curriculum. It was covering almost everything. Whatever would be there, there will be always ""this is also important, should be in the curriculum"" kind of critisizm. On top of the ones I added above, I would also like to see more ""futuristic"" topics (some experimental defenses, some unorthodox spacing ideas or the way of technology usage in NBA like leagues, latest academic studies on timing or mental health or you name it) as well for example. But I also strongly believe that having a nice stable curriculum and the foundation of the academy and then shaping it without rushing is the best way to create the excellence. So that's why I really liked that everything was based on Yugoslavian school and decided by the academicians of its representatives. However, I would shape it in a way that it covers both ""old school"" and ""new school"" if I can summarize roughly like that. And the way of managing it is keeping the foundation for sure, while adding different perspectives. That's why maybe instead of having the lectures as ""whole package"" from the Belgrade University, spreading this curriculum to the whole europe and all different ""basketball schools"" in Europe. 

  ","I would have expected a different ""atmosphere"" especially in terms of interaction with the Members. Only chance we had to chat with them was while they were waiting for their busses to get away from us :) Having the congress in a bigger gym instead of the hotel where the coaches are staying probably had this kind of disadvantage. But with some additional arrangements (maybe designated drinks at the end of everyday or with a some small event with simple lunch in the beginning of the Congress) this problem could have been tackled. 

Additionally, Congress should provide at least some simple catering like water/coffee/sandwich etc. (doesn't even need to be free). Especially when the lunch break was shorter due to some extended lectures, it was very difficult to find a solution for food/drinks. ","I liked the lectures a lot even though I couldn't attend most of them. But to me it didn't look professional to ask extra money and create some ""exclusiveness"" in the Academy. I would prefer having those lectures already part of the Academy lessons and if needed paying that extra together with the Academy fee. ","To me  the biggest technical problem was having different sources of communication, need of lots of different tools but mainly for the calendar. The calendar we had was great until it was not updated anymore. Additionally a ""dynamic"" calender that you can link with your phone/personal calendar would have been great. 

Mobile App was apperantly not sufficient but I know it is an ongoing process, so I skip the app related feedback.

About the operational manners, what I missed the most was the ""community spirit"". I was expecting more collaboration with the alumnis and the students. Some responsibilities could have given to a ""team"" of ambassadors or alumnis maybe instead of having just one person. An extended team cooperating with Jelena and distributing the responsibilities and communication would have made her also way more efficient and keep the interactions smoother. That's why related to this topic again; having study groups, practice week captains, work groups,  operational team etc. kind of ideas would create a self sufficient and dynamic community which would operate smoothly with combination of great help from dedicated (crazy) people like Jelena :) ","I saw two complete different parts of practice weeks. One was very well organized and with a  dedicated representative from EHCB (Real Madrid with Goran) and the other one was not organized at all and without a dedicated representative from EHCB (Panathinaikos). I will just repeat my suggestion for the sake of being recorded: there should be a check list of things what can teams/coaches offer to the visitor students and what they cannot. Then at least everyone can know upfront what they should expect. From Pao week, personally I already had expected no more communication than what we had (basically Hi & Bye only) with Coach Ataman but I think it is a shame that we couldn't even had a simple Q&A session with him. This kind of details (making him available) are the ""exclusiveness"" feeling that EHCB should try to create for their students. 

But anyways I enjoyed both experiences A LOT from all dimensions. Interaction with assistent coaches of both teams, Coach Mateo, all co-students and Goran was amazing. Lunch with Coach Itoudis was a great additional surprise. ",2,"Maybe it looked like I criticized a lot but all because I would like see that it just gets better in the upcoming generations. I LOVED being part of it and completely satisfied. I enjoyed everything, found something to enjoy with every dimension of it and had zero regrets about the time/money/energy I spent for it. Friendships and memories I collected are priceless. I already suggest it to the coaches that I know and would like to keep being part of it one way or another. 

Special thanks to everyone and their dedication who were part of it, starting with Goran and Jelena!",Yes,"Resume, Recommendation Letter, Some level of on court skills are needed probably for screening but I would add “a decent level of communication skills” and “will to share with community” instead of just seeing this as a ""service I am paying for"" should be somehow considered as criteria. And in my opinion the most important criteria should be ""will to join this Academy"". Rest will always come if someone really wants to join, learn from and share with the Academy. ",Website,"Q&A, Topic based, Maybe collecting ideas already in the beginning of the season from the students in terms of topics, like saying ""I would like to hear Match-up zone from Coach X because they have the best efficiency"". And collecting the questions already maybe one week before from the students and share them with everyone so everyone can rate the questions, then the best rated ones are directed to the coaches.  ","Direct questions to the students, Instant questions allowed, Questions in the end or seperate session, More like a video cast, one way communication to watch it later, Everyone has their own style, but if there is no change in the content or no interactivity is needed then maybe better to just have the video of the topic explained by teachers. Then after everyone watches that video, a live questions/answers session with the teacher would be more efficient. And maybe one more session after the “quiz”. Then the challenge of “having coaches with very different knowledge level” would be tackled a bit more. ","If possible, not much more than what it was. But clearly there is some extra budget needed to make it even better.","Sport Management, Sports Psychology, Sports Technology, Pedagogy"
