additional_comments_or_suggestions_about_Application_and_Registration_Process.csv,additional_comments_or_suggestions_about_the_Curriculum.csv,additional_comments_or_suggestions_about_Networking.csv,additional_comments_or_suggestions_about_the_Bonus_Lectures.csv,additional_comments_or_suggestions_about_the_Operational_and_Technical_Aspects.csv,additional_comments_or_suggestions_about_the_Practice_Weeks.csv,additional_comments_or_suggestions_about_the_Schedule_and_Attandance.csv,additional_comments_or_suggestions.csv,should_exams_be_part_of_the_curriculum.csv,screening_criteria.csv,decision_to_sign.csv,members_content.csv,what-kind-of-interactivity.csv,suggested-price.csv,what-to-add-for-curriculum.csv
I appreciated the process. I trusted the process. ,"It was good. really, it was good. ",the 2024 was my second congress (2023 first) I would try to make the 2025 for sure. ,appreciate Jelena's effort and thankful to every coach that talked with us.  ,"Yigit and Gabor did a very good job, we were in good hands all the way. ","I had miss my Week, I had a job interview in the US (I got the job)",5,EHCB should add a yearly membership fee and a member card with access to the names and contract of the other member. ,Yes,"Resume, Recommendation Letter, Minimum # of years of experience, I think there is value to bring in young coaches but the academy needs to stay prestigious, so maybe academy for young coaches and one for master coaches?   ",Congress from previous generations,"Q&A, Topic based, I liked both. ","Direct questions to the students, Instant questions allowed, Questions in the end or seperate session, More like a video cast, one way communication to watch it later","It is difficult to say, but I would argue that 2000 Euros is cheap. I would have think that 5000 Euros are a fair price. ",Sport Management
,,,,,I didn't participate in the practice weeks because I didn't have the means to travel and stay in Europe,2,The EHCB Academy provides a content-rich course as well as great networking with some of the best professionals in the industry. I hope it continues to grow and help develop the beautiful game of basketball all over the world,Yes,Resume,"Former Alumni(s), Phone Call Interview",Topic based,Instant questions allowed,2000,Sport Management
,There was some lectures so basic for the level of the coaching academy.,,,,,4,.,No,"Resume, Minimum # of years of experience, Coaching Licence Level","Video Content from previous generations, Congress from previous generations, Phone Call Interview",Topic based,Instant questions allowed,1500,Sport Management
,"When talking about basketball, professors could propose a topic, tactic situation, time out... and the students have to decide what they do in that situation, and discuss that decision with the professor or EHCB coaches. ",,,,I didn't join any practice but I did it on previous generations in Belgrade and Madrid ,4,Forum in the website to discuss in a more organized way ,Yes,"Coaching Licence Level, Coaches could do a small task prior their admissions to check their knowledge about basketball","Website, Social Media Post(s)",Topic based,Direct questions to the students,2000€ but always with the opportunity to get scholarships by collaborating with the academy ,Sports Psychology
,,,,There was alot of places to get the information from,I was not able to attend practice week because I live in another continent,3,I appreciated the oppression ,Yes,"Resume, Recommendation Letter, Minimum # of years of experience, Coaching Licence Level","Website, Social Media Post(s), Video Content from previous generations","Q&A, Topic based","Direct questions to the students, Questions in the end or seperate session, More like a video cast, one way communication to watch it later",1500,Sports Psychology
,,,,,Please do more efforts to help coach get their VISA  to attend practice week and congress ,4,"The practice week could be more interactive, like coaches not only watch team practices but  participate in some of them , and prepare a session to coach youth team for example , kind of practice exams where every coach must do his real work and show what he knows about basketball and coaching ",Yes,"Minimum # of years of experience, Coaching Licence Level",Former Alumni(s),"Q&A, Topic based",Direct questions to the students,2000 euros if they attend  the congress ,Sports Psychology
,"Since not all the coaches are professionals and working only in adult level, I would suggest to adjust some lectures about youth level coaching strengthening and planning","Again, great job in the Congress everything was perfect and very satisfying. I think one of the best experience I ever had.",,"Nothing to say, great job from all the support Stuff always were ready to help without delays.great job",,5,Definitely will suggest it (and already did) to other persons. It was a great experience,Yes,"Minimum # of years of experience, Coaching Licence Level","Website, Social Media Post(s), Video Content from previous generations",Topic based,"Direct questions to the students, Instant questions allowed",In think 1500-1800€ would be fair price ,"Sports Psychology, Youth level "
,,,,,,5,"From my experience in similar training programmes, I think that the approach to the subjects is excellent and comprehensive. 
High level in each subject scientifically documented. 
Perhaps the Academy should even consider creating a postgraduate degree in basketball coaching. 
Iam grateful for the experience!",No,Minimum # of years of experience,"Social Media Post(s), Video Content from previous generations",,Questions in the end or seperate session,3000,Sport Management
,,,,,,4,-,Yes,Resume,Website,Q&A,"More like a video cast, one way communication to watch it later",1000,Sports Psychology
,,,,,,4,Nothin’,Yes,"Resume, Recommendation Letter",Website,"Q&A, Topic based","More like a video cast, one way communication to watch it later",Same,"Sport Management, Sports Psychology"
,,,,,,5,All good and professional ,Yes,"Resume, Minimum # of years of experience, Coaching Licence Level",Former Alumni(s),Topic based,Questions in the end or seperate session,1000,Sports Psychology
"If I watch the videos on the app i need to touch my screen in every 10 seconds, the phone don't know the video format of the app. ",Video register from a practice from every coach. ,,,,,3,More specific zoom session with the coaches with topic and in the and Q&A session. ,Yes,Minimum # of years of experience,Social Media Post(s),Mixt Topic based and in the last part Q&A because many ask questions as jurnalists not as coaches. ,"Questions in the end or seperate session, More like a video cast, one way communication to watch it later",800,Sport Management
,,,,,,4,Thank you,Yes,Resume,"Website, Social Media Post(s)",Topic based,Direct questions to the students,same,"Sport Management, Sports Psychology"
,,,,,I live in Greece and due to my heavy daily schedule I couldn’t participate in out of court experiences and cannot judge correctly the travel’s accommodations etc,5,"I would like to have less detailed academic lectures since we studied in university and focus more on basketball lectures even more exams about technical and tactical topics
I am grateful to be one of the participants in this program !",Yes,"Resume, Minimum # of years of experience, I would recommend some more strict criteria on coaches level of knowledge and experience ","Website, Social Media Post(s), Former Alumni(s)",Topic based,Questions in the end or seperate session,Same price as before,Sport Management
,,I have not participated and couldn't watch the live stream. ,,,,4,,Yes,Resume,"Website, Social Media Post(s)",Topic based,"More like a video cast, one way communication to watch it later",,Sports Psychology
,,,,,,5,Go to the same  way :-) ,No,"Minimum # of years of experience, Coaching Licence Level",Former Alumni(s),Topic based,"More like a video cast, one way communication to watch it later",The same amount,"Sport Management, Sports Psychology"
Ceep it the same,,More structured ,,,More structured ,5,Ad some credits to the certificate ,Yes,Same,"Social Media Post(s), Video Content from previous generations, Congress from previous generations","Q&A, Topic based","Direct questions to the students, Instant questions allowed, Questions in the end or seperate session",Same,"Sport Management, Sports Psychology"
,,"I couldn’t attend the congress, but I watched the live stream and I think it was really good, the atmosphere of the congress, and visiting the top level coaches and learning from them was perfect ",,,"I was expecting to be more involved in the practice week. we were basically just watching the training sessions of the team, which was very good to watch, but I’ve heard that in some other practice weeks the coaching staff spend more time to talk with EHCB coaches about basketball, had an extra gathering to talk about basketball. in general the practice week could be much more useful…
Anyway I know that Efes team was in a hard situation at that time, but we were traveling from different countries around the world to attend that practice week, and were expecting more of that… Meeting with coach Erdem çan and spending time in his training sessions was very good.
By the way meeting with coach Ahmet çaki for 1 session was really great.
Best regards,,",4,"Everything was great, just about practice week, if it would be more organized for EHCB coaches to get the most out of it for the next generations, it would be perfect and we can gain and learn much more things from that..
Thank you,
Best regards",Yes,"Resume, Minimum # of years of experience","Website, Video Content from previous generations","Q&A, Topic based","Instant questions allowed, Questions in the end or seperate session","Maybe 1500 euros, because we have to pay for the practice weeks as well","Sport Management, Sports Psychology"
,,,,,"I supposed to be in Zenit, but couldn't make it. I mark 3 on everything bcuz of that.
I'll be happy to join one next season if I can ",3,"As a young coach, that was an amazing opportunity. I'm trying to learn from anyone as much as I can, and here I gain a lot of knowledge ",Yes,Recommendation Letter,Website,Topic based,Instant questions allowed,The current price is making a lot of sense,"Sport Management, Sports Psychology"
,,,,,,5,More tactical lectures,Yes,Minimum # of years of experience,Congress from previous generations,Topic based,Questions in the end or seperate session,3000 euros,Sport Management
,,,,,,4,,Yes,Resume,"Social Media Post(s), Phone Call Interview",Topic based,"Direct questions to the students, Questions in the end or seperate session",1000,"Sport Management, Sports Psychology"
,Sport Event Management and Marketing ,,,,,5,"EHCB 4th generation was indeed a great experienced and had gave me a great impact in life opening doors for me in the Gambia and other Countries in Africa like Ghana. I'll suggest for the dates and venue of the congress to announce 3 months prior to the event, making it easy for us coaches especially in Africa to book an appointment in the embassy earlier because having appointment to European countries is always difficult. Thank you ",Yes,"Resume, Recommendation Letter","Website, Social Media Post(s), Video Content from previous generations",Q&A,"Questions in the end or seperate session, More like a video cast, one way communication to watch it later",2000 Euro,"Sport Management, Sports Psychology"
,,"As I said, I thought it would be different, 4th generation student's could be together over the congress, or have one big moment just us to discuss something specific, maybe discussion about experience in practice weeks,  some dynamics to socialize. I had much more network with ""others"" than with the students. To be honest this was the most frustrating part, even more because some of them already knew each other because of practice week and It was really different be part of the small groups ",,,I didn't participate,4,"Maybe for European people is much more valuable to participate, everything is closer and there are more chances to participate and interact with the big group. Again the importance to have something different for students in the congress, I was talking with some friends about the EHCB and congress and they said I'm not going to do the whole thing cause I saw some people participating in congress without being students. But in the and the investment was good, experience was good, I think it worth the most.",Yes,"Resume, Recommendation Letter, An interview ","Website, Video Content from previous generations, Most important for me was related to information about the program, the content of the course and the coaches and professor's background  ","Q&A, Topic based, ","Direct questions to the students, Instant questions allowed","It's not bad, but thinking about coaches arround the world ( outside of Euro zone) it was almost impossible pay for the academy and go for practice week with all the investments ","Sport Management, Sports Psychology"
Promotion start for 5th Generation in social media to be started 1 month earlier than 2023,Each exam period should be announced by EHCB CA,4th Generation was awesome,Bonus lectures should remain a permanent offer at EHCB CA,WhatsApp should be replaced by a more professional communication platform ,Would love to attend other practice weeks as an Alumni/Ambassador next years,4,I’d love to become an ambassador and also work for EHCB CA,Yes,"Resume, Minimum # of years of experience, Coaching Licence Level, High Passion for Basketball","Website, Social Media Post(s), Phone Call Interview, Video Call Interview","Q&A, Topic based","Direct questions to the students, Instant questions allowed, Questions in the end or seperate session",2000,"Sport Management, Sports Psychology"
,,"Unfortunately I was not able to attend the Congress, hopefully next year.",,,"Great experience, probably would be even better if there was 3-5 coaches visiting, not 10-ish. But I know it is very hard to organise it with less number of coaches, because of the number of participants. ",3,"Maybe to find a way to ""reward"" the best students (based on the exams / homeworks, in person meetings at the practice weeks / congress interaction) and maybe offer them one more ""practice week"" or to be the part of the staff of one Euroleague team during their training camp (like Nba summer league). 
Where us, ""young coaches"" could actually coach and be a part of the staff for few days and have more closer / individual interactions and communications with Eurolague coaches / assistant coaches. 
Of course, all of us are ""dreaming"" to one day get to that level, to show our skills, our knowledge and potential, so maybe EHCB could become a platform where you get a chance to make your dreams come true :) 
",Yes,"Resume, Coaching Licence Level",Phone Call Interview,Topic based,Questions in the end or seperate session,I guess the same,"Sport Management, Sports Psychology"
,,,,,,5,No!,No,"Recommendation Letter, Minimum # of years of experience, Coaching Licence Level, At least A-B and 15 years experience",Former Alumni(s),Topic based,,1000,Sports Psychology
,,,,,,4,Keep up the good work.,Yes,"Recommendation Letter, Coaching Licence Level",Phone Call Interview,Topic based,Questions in the end or seperate session,Same like previous,"Sport Management, Sports Psychology"
None,None,,,,,4,None,,Open to all of the coaches who want to get into the accademy,Former Alumni(s),"Q&A, Topic based","Questions in the end or seperate session, More like a video cast, one way communication to watch it later",I don't know,Sports Psychology
,,,,,,5,Better facility with working aircondition in gym for next congres. ,Yes,"Resume, Minimum # of years of experience",Website,Topic based,Questions in the end or seperate session,What it is now,Sports Psychology
Keep in touch with the federations ,Team work by students ( groups) like lectures about some specific topics,It's great !,,The link of recorded lectures doesn't work after we are finished the program  ,It was a good experience!,4,Thank youuuuuuuu !,Yes,"Minimum # of years of experience, Coaching Licence Level",Congress from previous generations,Topic based,Questions in the end or seperate session,The same ,Sport Management
,,,,,"I think the best time is during the pre-season, during the build-up of the teams.",5,No,Yes,"Recommendation Letter, Minimum # of years of experience, Coaching Licence Level",Social Media Post(s),Topic based,"Instant questions allowed, Questions in the end or seperate session",2000 euro,Sport Management
,"Sport psychology about mental resilience would be highly interesting since it’s a topic more and more people become aware of. Since I studied sports management & now I’m trying to get into coaching on a higher level as well, this could be a very intriguing option. Maybe even give participants the option to choose additional modules like Sport Management, or Psychology  ",Please do NOT consider my answers regarding the congress because I was not able to attend! ,"it would be great to have multiple experts to cover the same topic eg. player development, just to compare how each coach/team handles it different. Maybe split the bonus lectures in modules too? Offensive/defensive team tactics, player development, leadership, etc",,"I had the feeling a lot of our week was on short notice and also the meeting with Žalgiris Academy responsibles  was, if I’m not mistaken, organised by a fellow student. Those things could/should be part of the practice week too (IF a EuroLeague team runs such a academy). ",3,"Overall due to the classes, the bonus lectures and the people met I increased my basketball knowledge and became more professional. Also running late in Kaunas and receive a very bad look from Coach Andrea Trincheri made me respect the time a lot more ;)",Yes,"Resume, Motivation letter of applicant, recommendation letter of current club","Website, Former Alumni(s)",Topic based,"Questions in the end or seperate session, More like a video cast, one way communication to watch it later, A video cast and one Q&A live session with smaller groups could be an idea. However, due to my fulltime job I was not always able to join libe classes, so this could be just me.",no changes required,"Sport Management, Sports Psychology"
,,,,,you should announce what should be expected points to have during the practice week and work on making these points happen,4,providing  job offers or being a volunteer coaches in the preseason will add more knowledge  and benefits for students,No,"Minimum # of years of experience, Coaching Licence Level","Website, the need of good basketball education",Topic based,Instant questions allowed,for my country the 2000 euros is very high ,"Sport Management, Sports Psychology"
,,It would have been nice to have your name called out even if you missed the congress . ,They really opened up my mind to coaching aspects and skill,N/a,If someone missed a practice week a good way would be to try and get them to attend one at a later date.,5,"It was a great experience and the wealth of knowledge from the coaches , lecturers and refs was immense.",No,Minimum # of years of experience,Social Media Post(s),Topic based,Questions in the end or seperate session,,Sport Management
I like the process at all,I will add more scouting as it is a very interesting and useful thing in coaching ,,,,"I have one of the best practice week,thank Goran for that!",5,Thanks for everything and for your development!,Yes,I like the previous system first registration than letter and cv in email and than a call with Elena ,Website,Topic based,I like the way they did but add a questions during the lectures as in medical module was done just to be in tonus during a lecture ,It will be better if it will be cheaper but we live in the world of money,Sports Psychology
,,,,,,5,Definitely coming back as alumni to gather more knowledge ,Yes,"Resume, Recommendation Letter",Friends ,Topic based,Instant questions allowed,"Half the current price, since you have to pay for everything during practice weeks, and congress","Sport Management, Sports Psychology"
,,,,,"Unbelievable experience, I still talk about those days and would do it all again next year :-)",4,"EHCB has definitely made me a better coach and person. I really enjoyed it from the first til the last day, especially the practice week and Congress. I have made some great connections with the students and colleagues, and for sure I will continue my further education with EHCB. My suggestion would be regarding modules. Leave them as they are, do not add or change anything. For example, the last month of academy was very busy and dynamic with the lessons and Q&A sessions, bonus lectures, etc, because many of them were cancelled during the course. The last day of congress should be the last day for all activities at the academy. And one more suggestion, the coach of the Euroleague Champion (if he is a member of EHCB) has to say hello to the students during the zoom meeting on the first day of the EHCB course.",Yes,Resume,"Website, Former Alumni(s), Phone Call Interview",Topic based,Questions in the end or seperate session,2000,"Sport Management, Player development "
,"Maybe medical module is not as useful as others, academy lectures about this topic are more than enough. EHCB members lectures to be topic based, so we can see their vision and knowledge where they are the best and most comfortable with. Of course, some Q&A are welcome and necessary. Also adding analytics module and player development lectures will be great","Improve the schedule, for example having enough time to have lunch. Also it would be great to have more exclusivity for the EHCB Academy students, for us to feel that world class basketball ourselves. Having opportunities to meet and talk exclusively with EHCB members would be amazing",I would love to have more of them. Any extra knowledge and opportunities to share basketball and learn from other coaches is always welcomed and a gift for anyone,"I would like communication channels to be more effective and clear. Whatsapp groups are difficult to follow, but are really great for interaction between coaches",,3,"Would be great to have more events and activities to enhance and help networking for all coaches. Also, decrease the number of students would help to improve this topic",Yes,"Resume, Recommendation Letter, Coaching Licence Level, Recommended by former alumni","Social Media Post(s), Phone Call Interview",Topic based,"Direct questions to the students, Questions in the end or seperate session","2000 is ok if it gets improvement in the communication processes, the academy platform and getting more exclusivity as previous generations","Sport Management, Sports Psychology, Enhance the scout module"
,"3*3 topic.
In each topic, the differences between youth and adults and male and female athletes should be stated.  For example, in the topic of sports nutrition, s&c and...",I saw the congress online and was not in person ,,"When we entered the class 5 or 10 minutes late, we could not be added to the panel list!  And since Jelena was angry with the student for asking for the panel list several times, I preferred to be in the class outside of the panel list or I would request yit and I would see a respectful behavior.","Due to work reasons, I could not use the chance to practice week, and Jelena assured me that I can use this quota next year.",3,"No direct contact was made for me with EuroLeague coaches, while I need a mentor to continue my coaching journey.",Yes,,"Social Media Post(s), from MR basketball page(mohamad rahimy) ",Topic based,"Direct questions to the students, Instant questions allowed",1500,"Sport Management, Sports Psychology, spiritual intelligence, Emotional intelligence "
I think that before all candidates fall into Jelena or Amit's hands would be good to have pre-screening call with alumnis who are good enough to do that kind of an interview.,,,,,Every city needs to have alumni which will be kind a tourist guide during Practice week. His/her task must be to prepare all relevant informations about the city where Practive week is held.,3,Excellent opportunity for everyone who wants to work in any piece of the basketball.,Yes,"Resume, Recommendation Letter, First video interview",Website,Q&A,"Direct questions to the students, Questions in the end or seperate session, Mini quiz after every single lesson (2-3 questions) within 5 minutes, so teacher can have a feeling about the lesson understanding.",Same as for this year if number of modules stay the same.,Sports Psychology
,,,,,,4,Practice weeks should happen during pre season,Yes,"Resume, Coaching Licence Level","Website, Social Media Post(s), Video Content from previous generations, Congress from previous generations",Topic based,Instant questions allowed,2000 euro,"Sports Psychology, Analytics"
